alibaba	经营范围：加工、产销：硅胶制品、宠物用品、办公用品、数码产品、电脑、眼镜配件、服饰、箱包皮具、日用百货、硅胶婴儿用品、工艺礼品、玩具、户外运动用品、橡塑制品。(依法须经.. ［已认证］	注册地址：中国广东东莞横沥镇隔坑村隔坑大道季仔坑路60号                                    查看地图	东莞 童装	https://yatiansilicone.1688.com/page/creditdetail.htm	注册资本：人民币300万元 ［已认证］	雅天硅胶源头厂家	17666559666	yatiansilicone	2018-03-26	联系人：彭小双	成立时间：2017年05月27日 ［已认证］
alibaba	经营范围：针纺织品来料加工、销售。（国家有专项规定的除外） ［已认证］	注册地址：中国江西吉安泰和县万合镇樟塘圩镇                                    查看地图	东莞 童装	https://shop1363627897931.1688.com/page/creditdetail.htm	注册资本：无需验资 ［已认证］	泰和县康扬针织制衣厂	13392393925	shop1363627897931	2018-03-26	联系人：康泉生	成立时间：2009年03月20日 ［已认证］
alibaba	经营范围：一般经营项目:玩具、母婴用品的销售及其它国内贸易；经营电子商务；货物及技术的进出口业务。许可经营项目: ［已认证］	注册地址：中国广东深圳罗湖区莲塘街道国威路莲塘工业区一小区104栋A305号                                    查看地图	东莞 童装	https://halekid.1688.com/page/creditdetail.htm	注册资本：人民币100万元 ［已认证］	深圳欧美泰玩具贸易有限公司	13068929988	halekid	2018-03-26	联系人：陈丽珍	成立时间：2013年05月09日 ［已认证］
alibaba	经营范围：零售：毛衣、服饰。 ［已认证］	注册地址：中国广东东莞大朗镇巷头社区富康路233号大朗毛织贸易中心1-B222铺一楼                                    查看地图	东莞 童装	https://dgyzxmy1.1688.com/page/creditdetail.htm	注册资本：无需验资 ［已认证］	东莞市大朗樱枝秀毛衣行	13543719992	dgyzxmy1	2018-03-26	联系人：李兰姣	成立时间：2008年12月08日 ［已认证］
alibaba	经营范围：研发、生产、加工、销售：橡塑制品、橡胶制品、硅胶制品、电子产品、电子配件、电器配件、五金制品及配件；货物进出口、技术进出口。 ［已认证］	注册地址：中国广东东莞横沥镇下车岗村风水坣聚和路20号                                    查看地图	东莞 童装	https://zhengweiguijiao.1688.com/page/creditdetail.htm	注册资本：人民币100万元 ［已认证］	正为精密橡塑源头厂家	18665160571	zhengweiguijiao	2018-03-26	联系人：戴小阳	成立时间：2016年03月29日 ［已认证］
alibaba	经营范围：零售、批发：服装。 ［已认证］	注册地址：中国广东东莞茶山镇茶山村吉街七横路220号                                    查看地图	东莞 童装	https://shop1478882715769.1688.com/page/creditdetail.htm	注册资本：无需验资 ［已认证］	东莞市茶山蓝柔服装店	13415008694	shop1478882715769	2018-03-26	联系人：蓝科鸿	成立时间：2016年08月24日 ［已认证］
alibaba	经营范围：一般经营项目:服装批发与零售 ［已认证］	注册地址：中国广东深圳宝安区西乡街道固戍二路石街新村5巷18号                                    查看地图	东莞 童装	https://shop1461689388134.1688.com/page/creditdetail.htm	注册资本：无需验资 ［已认证］	深圳市宝安区西乡雅尚轩服装批发商行	13543334535	shop1461689388134	2018-03-26	联系人：卢超胜	成立时间：2016年04月21日 ［已认证］
alibaba	经营范围：一般经营项目：   许可经营项目：   服饰，加工，批发零售 ［已认证］	注册地址：中国广东深圳宝安区石岩街道雅丽工业园B栋3楼                                    查看地图	东莞 童装	https://shanghaomei.1688.com/page/creditdetail.htm	注册资本：无需验资 ［已认证］	深圳市宝安区尚豪美服装厂	*	shanghaomei	2018-03-26	联系人：黄广聪	成立时间：2016年06月16日 ［已认证］
alibaba	经营范围：产销：硅橡胶制品、塑胶制品、电子、五金配件、玩具配件、工艺礼品、家居用品、模具；货物及技术进出口。 ［已认证］	注册地址：中国广东东莞东城街道温塘茶下工业区七区厂房B栋101室                                    查看地图	东莞 童装	https://15989921541.1688.com/page/creditdetail.htm	注册资本：人民币3万元 ［已认证］	东莞市准翔橡塑制品有限公司	15989921541	15989921541	2018-03-26	联系人：张涛	成立时间：2014年04月10日 ［已认证］
alibaba	经营范围：批发、零售：服装。 ［已认证］	注册地址：中国广东东莞大朗镇黎贝岭村兴市二路18号4号铺                                    查看地图	东莞 童装	https://lizhen13528.1688.com/page/creditdetail.htm	注册资本：无需验资 ［已认证］	东莞市大朗珍妙服饰商行	13652525237	lizhen13528	2018-03-26	联系人：李珍	成立时间：2014年05月27日 ［已认证］
alibaba	经营范围：许可经营项目：无。 一般经营项目：加工、销售：服装。(法律、行政法规和国务院决定禁止或者规定应当取得许可的项目除外) (依法须经批准的项目，经相关部门批.. ［已认证］	注册地址：中国广东东莞茶山镇增埗村塘边                                    查看地图	东莞 童装	https://hengdongzhiyi.1688.com/page/creditdetail.htm	注册资本：无需验资 ［已认证］	东莞市茶山恒东服装加工店	13612771118	hengdongzhiyi	2018-03-26	联系人：刘润章	成立时间：2013年04月24日 ［已认证］
alibaba	经营范围：一般经营项目:服饰的批发、销售许可经营项目: ［已认证］	注册地址：中国广东深圳宝安区沙井街道辛安路北七巷4号101B                                    查看地图	东莞 童装	https://shop1458147410729.1688.com/page/creditdetail.htm	注册资本：无需验资 ［已认证］	深圳市宝安区沙井芳依坊服饰经营部	17051172936	shop1458147410729	2018-03-26	联系人：李雪珍	成立时间：2016年03月09日 ［已认证］
alibaba	经营范围：生产、加工、销售：服装、服饰。 ［已认证］	注册地址：中国广东东莞大朗镇求富路社区求富路三区99号二楼                                    查看地图	东莞 童装	https://shop1491883684014.1688.com/page/creditdetail.htm	注册资本：人民币100万元 ［已认证］	东莞市唯童世家服装服饰有限公司	13925710400	shop1491883684014	2018-03-26	联系人：钟娟	成立时间：2017年03月20日 ［已认证］
alibaba	经营范围：生产、销售：体育用品、护具用品、布料、箱包、服装。 ［已认证］	注册地址：中国广东东莞寮步西溪田心村工业区                                    查看地图	东莞 童装	https://yixiangfactory.1688.com/page/creditdetail.htm	注册资本：无需验资 ［已认证］	东莞市寮步翼翔运动用品厂	13925859323	yixiangfactory	2018-03-26	联系人：袁莲	成立时间：2011年11月24日 ［已认证］
alibaba	经营范围：销售：运动用品、体育用品、手袋产品、杯套、工艺礼品。 ［已认证］	注册地址：中国广东东莞寮步镇石大路良边段132号(集群注册)                                    查看地图	东莞 童装	https://shop1466702219716.1688.com/page/creditdetail.htm	注册资本：人民币50万元 ［已认证］	东莞市宏铭运动用品有限公司	18925886253	shop1466702219716	2018-03-26	联系人：叶安安	成立时间：2016年06月16日 ［已认证］
alibaba	经营范围：生产、加工、销售：体育用品、运动用品、工艺礼品、箱包、手袋。 ［已认证］	注册地址：中国广东东莞寮步镇西溪雅香坊103号                                    查看地图	东莞 童装	https://hongtu08.1688.com/page/creditdetail.htm	注册资本：人民币10万元 ［已认证］	东莞鸿途体育用品有限公司	13458808000	hongtu08	2018-03-26	联系人：刘子豪	成立时间：2013年07月04日 ［已认证］
alibaba	经营范围：生产、加工、销售：服装、服饰、毛织品、鞋、帽、祙、皮革制品；货物进出口、技术进出口。(依法须经批准的项目，经相关部门批准后方可开展经营活动)〓 ［已认证］	注册地址：中国广东东莞大朗镇大井头社区第二工业区顺兴四路2号                                    查看地图	东莞 童装	https://shop4s17m10397038.1688.com/page/creditdetail.htm	注册资本：人民币100万元 ［已认证］	东莞市君君服装有限公司	15015101918	shop4s17m10397038	2018-03-26	联系人：	成立时间：2016年04月21日 ［已认证］
alibaba	经营范围：产销：硅胶制品、橡胶制品；销售：硅胶制品、硅橡胶制品、模具材料；货物进出口。（法律法规和国务院决定禁止或应经许可的项目除外） (依法须经批准的项目，经相关部门批.. ［已认证］	注册地址：中国广东东莞道滘镇南城工业第四小区8号                                    查看地图	东莞 童装	https://dgycxj.1688.com/page/creditdetail.htm	注册资本：人民币50万元 ［已认证］	东莞永成硅胶制品有限公司	13326856800	dgycxj	2018-03-26	联系人：瞿玉兰	成立时间：2010年09月03日 ［已认证］
alibaba	经营范围：一般经营项目:体育用品、婴童用品、礼品套装、针纺织品、钟表、玩具、电子产品及周边产品的销售，国内贸易，货物及技术进出口。（不含法律、行政法规、国务院决定禁止及规.. ［已认证］	注册地址：中国广东深圳宝安区新安街道35区安华工业区8号B栋五楼之一                                    查看地图	东莞 童装	https://shop1364490936980.1688.com/page/creditdetail.htm	注册资本：无需验资 ［已认证］	深圳市力科达礼品厂	15914122794	shop1364490936980	2018-03-26	联系人：宋真真	成立时间：2004年03月18日 ［已认证］
alibaba	经营范围：研发、产销、加工：婴儿用品、玩具、礼品、包、服装、鞋、童车。（依法须经批准的项目，经相关部门批准后方可开展经营活动）〓 ［已认证］	注册地址：中国广东东莞茶山镇卢边村大基工业区                                    查看地图	东莞 童装	https://duoxihai.1688.com/page/creditdetail.htm	注册资本：人民币100万元 ［已认证］	东莞市宏阳婴童玩具用品有限公司	13925810329	duoxihai	2018-03-26	联系人：王太阳	成立时间：2017年03月21日 ［已认证］
alibaba	经营范围：产销：运动用品、箱包、手袋、布料、潜水料。 (依法须经批准的项目，经相关部门批准后方可开展经营活动)〓? ［已认证］	注册地址：中国广东东莞寮步镇石大路良边路段142-146号                                    查看地图	东莞 童装	https://shop1396457588619.1688.com/page/creditdetail.htm	注册资本：无需验资 ［已认证］	东莞市鑫鹏运动用品厂	13686120002	shop1396457588619	2018-03-26	联系人：余长元	成立时间：2014年03月21日 ［已认证］
alibaba	经营范围：销售：运动用品、体育用品、手袋、箱包、服饰及配饰、纺织品；零售：电子产品。(依法须经批准的项目，经相关部门批准后方可开展经营活动)〓 ［已认证］	注册地址：中国广东东莞寮步镇坑口社区源溪六巷231号                                    查看地图	东莞 童装	https://shop15e4310du53x5.1688.com/page/creditdetail.htm	注册资本：无需验资 ［已认证］	东莞市寮步塞尔日运动用品经营部	13560820677	shop15e4310du53x5	2018-03-26	联系人：李晓宁	成立时间：2017年11月23日 ［已认证］
alibaba	经营范围：销售：儿童内裤、儿童袜子、儿童书包、儿童帽子、儿童手套、儿童围巾、成人手套。 ［已认证］	注册地址：中国广东东莞石龙镇黄州京瓷路惠如新村第二幢南7(集群注册)                                    查看地图	东莞 童装	https://shop53h06v32v3142.1688.com/page/creditdetail.htm	注册资本：人民币100万元 ［已认证］	东莞市乐桐服饰有限公司	固话：0769 - 28348870	shop53h06v32v3142	2018-03-26	联系人：谭灿科	成立时间：2017年09月21日 ［已认证］
alibaba	经营范围：产销：塑胶产品、五金电子产品、工艺品及饰品；销售：手袋、箱包、厨具，日用品。 ［已认证］	注册地址：中国广东东莞长安镇新安新辉路东3号B座4楼                                    查看地图	东莞 童装	https://dghuijiudianzi.1688.com/page/creditdetail.htm	注册资本：人民币20万元 ［已认证］	东莞市惠久塑胶电子有限公司	18825827592	dghuijiudianzi	2018-03-26	联系人：陈婷	成立时间：2012年06月14日 ［已认证］
alibaba	经营范围：一般经营项目：产销：运动用品、户外体育用品、手袋、杯套、电子包装、潜水料体育用品、工艺礼品；从事货物进出口、技术进出口业务（法律、行政法规规定禁止的项目除外，法.. ［已认证］	注册地址：中国广东东莞寮步镇良边工业区翠香横路                                    查看地图	东莞 童装	https://shop1426179162861.1688.com/page/creditdetail.htm	注册资本：人民币50万元 ［已认证］	东莞市宏邦运动用品有限公司	18938238501	shop1426179162861	2018-03-26	联系人：阮卫星	成立时间：2014年01月06日 ［已认证］
alibaba	经营范围：一般经营项目:???儿童用品的购销；国内商业、物资供销业（不含专营、专控、专卖商品）。 ［已认证］	注册地址：中国广东深圳龙岗区坂田街道十二橡树庄园K2栋12A                                    查看地图	东莞 童装	https://szaideli.1688.com/page/creditdetail.htm	注册资本：人民币500万元 ［已认证］	深圳市爱得利婴幼儿用品有限公司	固话：0755 - 83866287	szaideli	2018-03-26	联系人：张春华	成立时间：2003年04月25日 ［已认证］
alibaba	经营范围：商品批发贸易（许可审批类商品除外）;商品零售贸易（许可审批类商品除外）;贸易代理;货物进出口（专营专控商品除外）;技术进出口;皮革及皮革制品批发; ［已认证］	注册地址：中国广东广州越秀区水荫路119号星光映景16层0245号                                    查看地图	东莞 童装	https://shop1419957801814.1688.com/page/creditdetail.htm	注册资本：人民币50万元 ［已认证］	广州锦郎皮具有限公司	17786849989	shop1419957801814	2018-03-26	联系人：邓伟	成立时间：2014年07月10日 ［已认证］
alibaba	经营范围：产销：服装、服饰。 (依法须经批准的项目，经相关部门批准后方可开展经营活动)〓 ［已认证］	注册地址：中国广东东莞茶山镇增埗村沙墩                                    查看地图	东莞 童装	https://shop1372179443786.1688.com/page/creditdetail.htm	注册资本：人民币10万元 ［已认证］	东莞市泽美服饰有限公司	13725758852	shop1372179443786	2018-03-26	联系人：胡小珍	成立时间：2013年04月09日 ［已认证］
alibaba	经营范围：研发、销售：电子产品、手机配件、电子礼品、五金制品、塑胶制品。 ［已认证］	注册地址：中国广东东莞塘厦镇四村社区迎宾大道5号东莞农村商业银行大厦百司汇商务中心2005号                                    查看地图	东莞 童装	https://shop28z5791219jc9.1688.com/page/creditdetail.htm	注册资本：人民币500万元 ［已认证］	东莞市酷之克电子科技有限公司	13794976755	shop28z5791219jc9	2018-03-26	联系人：翁应贵	成立时间：2017年08月23日 ［已认证］
alibaba	经营范围：研发、产销、加工：电子制品。 ［已认证］	注册地址：中国广东东莞石排镇李家坊工业区                                    查看地图	东莞 童装	https://shop1429548361662.1688.com/page/creditdetail.htm	注册资本：人民币100万元 ［已认证］	东莞市鲁兴电子科技有限公司	13925747758	shop1429548361662	2018-03-26	联系人：龚奕鹏	成立时间：2014年12月11日 ［已认证］
alibaba	经营范围：许可经营项目：无。 一般经营项目：零售：玩具。（法律、行政法规和国务院决定禁止或者规定应当取得许可的项目除外） ［已认证］	注册地址：中国广东东莞茶山镇下朗村                                    查看地图	东莞 童装	https://13925776358.1688.com/page/creditdetail.htm	注册资本：无需验资 ［已认证］	东莞市茶山鸣辉玩具经营部	15017155463	13925776358	2018-03-26	联系人：王学芳	成立时间：2013年05月06日 ［已认证］
alibaba	经营范围：批发、零售：服饰、箱包、鞋子、母婴用品。(依法须经批准的项目，经相关部门批准后方可开展经营活动)〓 ［已认证］	注册地址：中国广东东莞莞城东纵大道地王广场第三区二层2273号                                    查看地图	东莞 童装	https://xt2005elysia.1688.com/page/creditdetail.htm	注册资本：人民币50万元 ［已认证］	东莞市媛玲贸易有限公司	18825560671	xt2005elysia	2018-03-26	联系人：廖媛玲	成立时间：2015年01月05日 ［已认证］
alibaba	经营范围：一般经营项目：服装批发零售。许可经营项目：服装的生产。 ［已认证］	注册地址：中国广东深圳南山区蛇口街道后海大道25号东角头工业小区A2栋301                                    查看地图	东莞 童装	https://shop1457628716924.1688.com/page/creditdetail.htm	注册资本：无需验资 ［已认证］	深圳市南山区衣着丽服装厂	13662959092	shop1457628716924	2018-03-26	联系人：李福汶	成立时间：2016年03月04日 ［已认证］
alibaba	经营范围：产销、加工：服饰、服装。（法律、行政法规、国务院决定禁止或者规定应当取得许可的项目除外） ［已认证］	注册地址：中国广东东莞道滘镇金牛新村四横路4号                                    查看地图	东莞 童装	https://dgfangfangfushi.1688.com/page/creditdetail.htm	注册资本：人民币50万元 ［已认证］	东莞市芳芳服饰有限公司	18925729958	dgfangfangfushi	2018-03-26	联系人：陈清国	成立时间：2013年09月04日 ［已认证］
alibaba	经营范围：服装批发和零售。^ ［已认证］	注册地址：中国广东深圳宝安区新桥街道万丰社区大钟岗路二巷106号                                    查看地图	东莞 童装	https://shop976t2619099r6.1688.com/page/creditdetail.htm	注册资本：无需验资 ［已认证］	深圳市宝安区新桥斯衣兰卡服装商行	*	shop976t2619099r6	2018-03-26	联系人：黎才良	成立时间：2017年09月07日 ［已认证］
alibaba	经营范围：零售：百货、日杂、五金交电、文具用品、玩具、针织品、日用品、洗涤用品、化妆品、鞋、大米、数码产品；复印、摄影服务。 ［已认证］	注册地址：中国广东茂名信宜市新里开发区三区二十单元陈晓屋首层                                    查看地图	东莞 童装	https://18122916384.1688.com/page/creditdetail.htm	注册资本：无需验资 ［已认证］	信宜市大众百货店	固话：0769 - 15916227761	18122916384	2018-03-26	联系人：何忠玲	成立时间：2007年10月18日 ［已认证］
alibaba	经营范围：研发、产销：硅胶制品、塑胶制品、通用机械设备、五金电子、化妆品、专业机械设备、电子产品；货物进出口、技术进出口。 (依法须经批准的项目，经相关部门批准后.. ［已认证］	注册地址：中国广东东莞石碣镇水南村幸福街4号                                    查看地图	东莞 童装	https://shop1418002966742.1688.com/page/creditdetail.htm	注册资本：人民币200万元 ［已认证］	东莞市贝康硅胶制品有限公司	13713298889	shop1418002966742	2018-03-26	联系人：梁文悦	成立时间：2014年11月05日 ［已认证］
alibaba	注册资本：RMB 0 万元	注册地址：南山区沙河街道塘头村二坊496号102号铺                                    查看地图	东莞 童装	https://shop1457715597288.1688.com/page/creditdetail.htm	成立时间：2016-03-04	深圳市南山区芊忆服饰商行	15219907565	shop1457715597288	2018-03-26	联系人：黄天胜	企业名称：深圳市南山区芊忆服饰商行 ［已认证］
alibaba	注册资本：RMB 0 万元	注册地址：万江区石美社区环城街155号                                    查看地图	东莞 童装	https://haomayaochihtc.1688.com/page/creditdetail.htm	成立时间：2014-01-06	东莞市万江继发服装销售部	13450604651	haomayaochihtc	2018-03-26	联系人：罗欲丽	企业名称：东莞市万江继发服装销售部 ［已认证］
alibaba	经营范围：一般经营项目:塑胶、五金、电子产品的销售；国内贸易；货物及技术进出口。(法律、行政法规禁止的项目除外；法律、行政法规限制的项目须取得许可后方可经营） ［已认证］	注册地址：中国广东深圳龙华新区民治街道金地梅陇镇17栋2单元18A                                    查看地图	东莞 童装	https://xqctech.1688.com/page/creditdetail.htm	注册资本：人民币10万元 ［已认证］	深圳市新启晨科技有限公司	15986842800	xqctech	2018-03-26	联系人：唐谦	成立时间：2015年02月04日 ［已认证］
alibaba	经营范围：研发、产销、加工：橡胶制品、塑胶制品、硅胶制品、电子产品及其配件、货物进出口、技术进出口。 ［已认证］	注册地址：中国广东东莞塘厦镇莲湖社区白泥湖路46号2楼                                    查看地图	东莞 童装	https://shop1493743882897.1688.com/page/creditdetail.htm	注册资本：人民币50万元 ［已认证］	咔朴橡塑科技（东莞）有限公司	固话：0769 - 33269120	shop1493743882897	2018-03-26	联系人：徐敏青	成立时间：2016年12月26日 ［已认证］
alibaba	经营范围：加工、销售：橡胶制品、电子配件。(依法须经批准的项目，经相关部门批准后方可开展经营活动)〓 ［已认证］	注册地址：中国广东东莞常平镇苏坑村下甲龙井路                                    查看地图	东莞 童装	https://dtrubber.1688.com/page/creditdetail.htm	注册资本：无需验资 ［已认证］	东莞市常平盛杰橡胶制品厂	13712021295	dtrubber	2018-03-26	联系人：王哲	成立时间：2008年02月04日 ［已认证］
alibaba	经营范围：一般经营项目：批发、零售：童装。 许可经营项目：无（一般经营项目可以自主经营；许可经营项目凭批准文件、证件经营） ［已认证］	注册地址：中国广东东莞虎门镇永安路41号之二楼B30号铺                                    查看地图	东莞 童装	https://shop1492534012690.1688.com/page/creditdetail.htm	注册资本：无需验资 ［已认证］	东莞市虎门裳艺童装经营部	固话：0769 - 82188593	shop1492534012690	2018-03-26	联系人：林秀枝	成立时间：2014年01月13日 ［已认证］
alibaba	经营范围：产销：服饰、服装；销售：服装辅料、鞋、帽、袜、皮具、手袋、箱包、饰品。 ［已认证］	注册地址：中国广东东莞虎门镇博涌社区社岗东坊十一巷一号二楼                                    查看地图	东莞 童装	https://luokebeibei.1688.com/page/creditdetail.htm	注册资本：人民币100万元 ［已认证］	东莞市火兔服饰有限公司	13652539191	luokebeibei	2018-03-26	联系人：李伟	成立时间：2013年11月06日 ［已认证］
alibaba	经营范围：生产、加工、销售、网上销售：电脑针织品、服装、服饰。(依法须经批准的项目，经相关部门批准后方可开展经营活动)〓 ［已认证］	注册地址：中国广东东莞大朗镇巷头社区沙梨园21号                                    查看地图	东莞 童装	https://shop1395766429722.1688.com/page/creditdetail.htm	注册资本：人民币50万元 ［已认证］	东莞市惠乐电脑针织有限公司	13360456999	shop1395766429722	2018-03-26	联系人：李银周	成立时间：2016年06月17日 ［已认证］
alibaba	经营范围：产销：服饰、服装。(依法须经批准的项目，经相关部门批准后方可开展经营活动)〓 ［已认证］	注册地址：中国广东东莞虎门镇北栅仁中岗村民小组河潭团结二路3号                                    查看地图	东莞 童装	https://smfsvip.1688.com/page/creditdetail.htm	注册资本：人民币50万元 ［已认证］	东莞市森淼服饰有限公司	13925583891	smfsvip	2018-03-26	联系人：黄小珍	成立时间：2011年10月25日 ［已认证］
alibaba	经营范围：加工、销售：毛织品。 ［已认证］	注册地址：中国广东东莞大朗镇巷头社区广东毛织市场一楼75号                                    查看地图	东莞 童装	https://shop118087s257312.1688.com/page/creditdetail.htm	注册资本：无需验资 ［已认证］	东莞市大朗睿龙毛织厂	13713095198	shop118087s257312	2018-03-26	联系人：李建华	成立时间：2017年09月12日 ［已认证］
