alibaba	经营范围：批发、零售:服装、服装辅料、布料。(依法须经批准的项目，经相关部门批准后方可开展经营活动)〓 ［已认证］	注册地址：中国广东东莞南城街道新基社区元圹坊22号                                    查看地图	东莞 童装	https://shop2r1v467648p80.1688.com/page/creditdetail.htm	注册资本：无需验资 ［已认证］	东莞市南城琰琰服装店	固话：0769 - 13728116805	shop2r1v467648p80	2018-03-26	联系人：苏琰	成立时间：2017年11月28日 ［已认证］
alibaba	经营范围：加工：针织品。(依法须经批准的项目，经相关部门批准后方可开展经营活动)〓 ［已认证］	注册地址：中国广东东莞大朗镇蔡边村盘古庙区31号                                    查看地图	东莞 童装	https://yiweierfuzhuang.1688.com/page/creditdetail.htm	注册资本：无需验资 ［已认证］	东莞市大朗依韦针织厂	17051179861	yiweierfuzhuang	2018-03-26	联系人：王利华	成立时间：2016年12月01日 ［已认证］
alibaba	经营范围：销售：服饰、服装、布料、服装辅料、鞋、帽、袜、内衣、皮具、箱包、饰品、电子产品、床上用品、户外运动用品、母婴用品、文具礼品、工艺品、家居用品、日用品。 .. ［已认证］	注册地址：中国广东东莞长安镇上沙社区西坊路1114号                                    查看地图	东莞 童装	https://oujing.1688.com/page/creditdetail.htm	注册资本：人民币50万元 ［已认证］	东莞市欧婧服饰有限公司	13717335445	oujing	2018-03-26	联系人：黄丽丽	成立时间：2015年09月16日 ［已认证］
alibaba	经营范围：生产、销售：服饰、服装、鞋、帽、皮具。(依法须经批准的项目，经相关部门批准后方可开展经营活动)〓 ［已认证］	注册地址：中国广东东莞虎门镇龙眼社区龙眼路五路69号五楼501号                                    查看地图	东莞 童装	https://ouxun13580902156.1688.com/page/creditdetail.htm	注册资本：人民币100万元 ［已认证］	东莞市欧讯服饰有限公司	*	ouxun13580902156	2018-03-26	联系人：杨阳洋	成立时间：2017年05月12日 ［已认证］
alibaba	经营范围：生产、加工、销售：服饰、服装、纺织品、针织品、服装辅料、箱包、皮革制品；货物进出口、技术进出口。 ［已认证］	注册地址：中国广东东莞大朗镇大井头社区朗东路288号1号铺                                    查看地图	东莞 童装	https://shop81137281mm676.1688.com/page/creditdetail.htm	注册资本：人民币100万元 ［已认证］	东莞市世一服饰有限公司	13958711437	shop81137281mm676	2018-03-26	联系人：林宗胜	成立时间：2016年07月06日 ［已认证］
alibaba	经营范围：批发、零售：服装 (依法须经批准的项目，经相关部门批准后方可开展经营活动)〓? ［已认证］	注册地址：中国广东东莞虎门镇九门寨社区结沟路路二巷4号                                    查看地图	东莞 童装	https://shop4k676258562d1.1688.com/page/creditdetail.htm	注册资本：无需验资 ［已认证］	东莞市虎门陈新服装商行	固话：0769 - 5000000	shop4k676258562d1	2018-03-26	联系人：陈新	成立时间：2017年12月07日 ［已认证］
alibaba	经营范围：批发、零售、设计：服饰、服装、鞋、袜、帽、书包、文具、皮带、雨具、玩具、饰物、工艺礼品；货物进出口。 (依法须经批准的项目，经相关部门批准后方可开展经营活动)〓.. ［已认证］	注册地址：中国广东东莞虎门镇虎门国际布料交易中心B区2幢3层09号                                    查看地图	东莞 童装	https://whosebaby.1688.com/page/creditdetail.htm	注册资本：人民币50万元 ［已认证］	东莞市小山猪服饰有限公司	13532766966	whosebaby	2018-03-26	联系人：孙正琼	成立时间：2014年03月18日 ［已认证］
alibaba	经营范围：服装的批发、零售。 ［已认证］	注册地址：中国广东深圳龙岗区坪地街道六联社区发方村富临路16-1号                                    查看地图	东莞 童装	https://shop04o1353049fv7.1688.com/page/creditdetail.htm	注册资本：无需验资 ［已认证］	深圳市龙岗区清新阁服装商行	14778673133	shop04o1353049fv7	2018-03-26	联系人：曾宪群	成立时间：2018年03月19日 ［已认证］
alibaba	经营范围：经营各类商品和技术的进出口（不另附进出口商品目录），但国家限定公司经营或禁止进出口的商品及技术除外；其他未列明批发业（不含需经许可审批的经营项目）；婴幼儿配方乳.. ［已认证］	注册地址：中国福建厦门思明区湖滨南路334号二轻大厦1212室之二十                                    查看地图	东莞 童装	https://520cartoonbaby.1688.com/page/creditdetail.htm	注册资本：人民币100万元 ［已认证］	厦门动漫宝贝婴童用品有限公司	13712994161	520cartoonbaby	2018-03-26	联系人：涂培厅	成立时间：2015年05月08日 ［已认证］
alibaba	经营范围：婴儿用品批发;服装批发;服装零售;婴儿用品零售; ［已认证］	注册地址：中国广东广州荔湾区中山八路99号贰楼B2042号档                                    查看地图	东莞 童装	https://lionbear.1688.com/page/creditdetail.htm	注册资本：无需验资 ［已认证］	广州市荔湾区狮子熊婴幼儿用品商行	15013070338	lionbear	2018-03-26	联系人：陈文文	成立时间：2014年01月08日 ［已认证］
alibaba	经营范围：生产、加工：服饰、服装、毛织品；货物进出口、技术进出口。(依法须经批准的项目，经相关部门批准后方可开展经营活动)〓 ［已认证］	注册地址：中国广东东莞大朗镇佛新社区银源一街37号                                    查看地图	东莞 童装	https://shop7e561k1x33406.1688.com/page/creditdetail.htm	注册资本：人民币100万元 ［已认证］	东莞市汇莱服饰有限公司	15766217528	shop7e561k1x33406	2018-03-26	联系人：刘超	成立时间：2017年05月02日 ［已认证］
alibaba	经营范围：许可经营项目:???服饰，加工，批发零售 ［已认证］	注册地址：中国广东深圳宝安区石岩街道宏发工业园5栋3楼                                    查看地图	东莞 童装	https://shop1461689688807.1688.com/page/creditdetail.htm	注册资本：无需验资 ［已认证］	深圳市宝安区石岩芳林秀衣制衣厂	固话：0769 - 339672321	shop1461689688807	2018-03-26	联系人：周天兰	成立时间：2016年04月20日 ［已认证］
alibaba	注册资本：人民币 3 万元	注册地址：深圳市南山区诺德假日花园5号楼117                                    查看地图	东莞 童装	https://sugarduck.1688.com/page/creditdetail.htm	成立时间：2012-12-14	深圳市南山区卡通童装商店	*	sugarduck	2018-03-26	联系人：张瑾	企业名称：深圳市南山区卡通童装商店 ［已认证］
alibaba	经营范围：批发、零售、网上销售：服饰、服装、童装、布料、内衣、袜、帽、鞋、儿童日用品。(依法须经批准的项目，经相关部门批准后方可开展经营活动)〓 ［已认证］	注册地址：中国广东东莞虎门镇永安路41号之三楼C61号铺                                    查看地图	东莞 童装	https://kekerou.1688.com/page/creditdetail.htm	注册资本：人民币100万元 ［已认证］	东莞市可乐熊服饰有限公司	13631404600	kekerou	2018-03-26	联系人：蔡海杰	成立时间：2017年04月24日 ［已认证］
alibaba	经营范围：生产、批发：服装。(依法须经批准的项目，经相关部门批准后方可开展经营活动)〓 ［已认证］	注册地址：中国广东东莞沙田镇稔洲村合宜围小组32号                                    查看地图	东莞 童装	https://shop1491930496466.1688.com/page/creditdetail.htm	注册资本：无需验资 ［已认证］	东莞市沙田美相服装厂	*	shop1491930496466	2018-03-26	联系人：兰恒玉	成立时间：2017年04月01日 ［已认证］
alibaba	经营范围：产销：服饰、服装。(依法须经批准的项目，经相关部门批准后方可开展经营活动)〓 ［已认证］	注册地址：中国广东东莞虎门镇北栅社区西兴3街18号                                    查看地图	东莞 童装	https://dgqlfs.1688.com/page/creditdetail.htm	注册资本：人民币10万元 ［已认证］	东莞市钎链服饰有限公司	18824940609	dgqlfs	2018-03-26	联系人：黄进健	成立时间：2016年05月23日 ［已认证］
alibaba	经营范围：批发、零售：毛织服饰、鞋、工作制服、工艺品、饰品，服装设计、品牌设计，货物及技术进出口。 (依法须经批准的项目，经相关部门批准后方可开展经营活动)〓 ［已认证］	注册地址：中国广东东莞南城区鸿福路200号第一国际汇一城3号办公楼601之三                                    查看地图	东莞 童装	https://shop1422031434654.1688.com/page/creditdetail.htm	注册资本：人民币50万元 ［已认证］	东莞市薇漾服饰有限公司	18819489427	shop1422031434654	2018-03-26	联系人：陈志颖	成立时间：2014年12月22日 ［已认证］
alibaba	经营范围：产销：服饰、服装；电脑绣花；销售：布料、服装辅料、鞋、帽、袜、内衣、皮具、箱包、饰品、电子产品、床上用品、户外运动用品、母婴用品；货物进出口、技术进出口。 ［已认证］	注册地址：中国广东东莞虎门镇北栅南坊工业区西坊路277号之2                                    查看地图	东莞 童装	https://shop83w8044v2v837.1688.com/page/creditdetail.htm	注册资本：人民币100万元 ［已认证］	东莞市彤泰服饰有限公司	*	shop83w8044v2v837	2018-03-26	联系人：	成立时间：2014年10月08日 ［已认证］
alibaba	经营范围：一般经营项目:经营货物及技术进出口（法律、行政法规、国务院决定禁止的项目除外，限制的项目须取得许可后方可经营）；毛线玩具、婴儿衣服、布娃娃、鞋、汽车内装饰品的购.. ［已认证］	注册地址：中国广东深圳龙岗区龙岗街道龙东社区大埔村同昌路30号C座3楼                                    查看地图	东莞 童装	https://shop1432227515840.1688.com/page/creditdetail.htm	注册资本：人民币50万元 ［已认证］	深圳亿欧玩具制衣有限公司	13058558748	shop1432227515840	2018-03-26	联系人：邓文明	成立时间：2015年05月18日 ［已认证］
alibaba	经营范围：服装、服饰的批发零售。^服装、服饰的生产加工。 ［已认证］	注册地址：中国广东深圳龙岗区龙岗街道龙西社区大发工业区10栋厂房1层                                    查看地图	东莞 童装	https://chengjingyi168.1688.com/page/creditdetail.htm	注册资本：无需验资 ［已认证］	深圳市龙岗区诚精艺服饰厂	18898733062	chengjingyi168	2018-03-26	联系人：刘广林	成立时间：2018年03月01日 ［已认证］
alibaba	经营范围：加工、产销：服装。 (依法须经批准的项目，经相关部门批准后方可开展经营活动)〓 ［已认证］	注册地址：中国广东东莞茶山镇上元村大塘工业区                                    查看地图	东莞 童装	https://bonniecat.1688.com/page/creditdetail.htm	注册资本：无需验资 ［已认证］	东莞市茶山鸿基服装厂	13712347472	bonniecat	2018-03-26	联系人：陈绍求	成立时间：2017年06月01日 ［已认证］
alibaba	经营范围：一般经营项目：服装的批发零售。许可经营项目：服装的生产、加工。 ［已认证］	注册地址：中国广东深圳南山区桃源街道平山一路大园工业区12栋4楼                                    查看地图	东莞 童装	https://tianchuan.1688.com/page/creditdetail.htm	注册资本：无需验资 ［已认证］	深圳市南山区天创泰服装厂	固话：0769 - 55553698	tianchuan	2018-03-26	联系人：彭飞	成立时间：2015年09月18日 ［已认证］
alibaba	经营范围：一般经营项目：销售：服饰、服装、化妆品。 许可经营项目：无。（一般经营项目可以自主经营；许可经营项目凭批准文件、证件经营） ［已认证］	注册地址：中国广东东莞虎门镇仁贵街66号之一铺位                                    查看地图	东莞 童装	https://shop1430326606649.1688.com/page/creditdetail.htm	注册资本：无需验资 ［已认证］	东莞市虎门雅娜儿服饰店	15818378488	shop1430326606649	2018-03-26	联系人：邓肖平	成立时间：2013年10月22日 ［已认证］
alibaba	经营范围：产销：服装、服饰。 ［已认证］	注册地址：中国广东东莞虎门镇北栅社区凤宁路27号                                    查看地图	东莞 童装	https://shop1447693178395.1688.com/page/creditdetail.htm	注册资本：人民币100万元 ［已认证］	东莞市美琪奇异果服饰有限公司	18028202382	shop1447693178395	2018-03-26	联系人：张钊	成立时间：2015年01月23日 ［已认证］
alibaba	经营范围：批发、零售：服装、饰品。 ［已认证］	注册地址：中国广东东莞万江区水蛇涌社区盈丰花园A10号铺                                    查看地图	东莞 童装	https://yihaoshangxing.1688.com/page/creditdetail.htm	注册资本：无需验资 ［已认证］	东莞市万江壹好服装商行	*	yihaoshangxing	2018-03-26	联系人：郑裕威	成立时间：2015年03月19日 ［已认证］
alibaba	经营范围：销售：服装、鞋帽。(依法须经批准的项目，经相关部门批准后方可开展经营活动)〓 ［已认证］	注册地址：中国广东东莞石碣镇新城区同富路西36号(集群注册)                                    查看地图	东莞 童装	https://naibababy.1688.com/page/creditdetail.htm	注册资本：人民币100万元 ［已认证］	东莞昕动服饰有限公司	15878882788	naibababy	2018-03-26	联系人：	成立时间：2017年03月13日 ［已认证］
alibaba	经营范围：产销：服装。 (依法须经批准的项目，经相关部门批准后方可开展经营活动)〓 ［已认证］	注册地址：中国广东东莞沙田镇齐沙新围新村南路二巷7号                                    查看地图	东莞 童装	https://shop0996e5s155323.1688.com/page/creditdetail.htm	注册资本：无需验资 ［已认证］	东莞市沙田忆流年服装厂	18820316181	shop0996e5s155323	2018-03-26	联系人：黄家海	成立时间：2017年08月25日 ［已认证］
alibaba	注册资本：人民币元 80 万元	注册地址：东莞市东城街道牛山光明大道东城中云智慧城市产业园内C栋3层302(集群注册)                                    查看地图	东莞 童装	https://shop2422m90q44483.1688.com/page/creditdetail.htm	成立时间：2017-07-25	东莞市艺贝实业投资有限公司	15817666519	shop2422m90q44483	2018-03-26	联系人：陈云凤	企业名称：东莞市艺贝实业投资有限公司 ［已认证］
alibaba	经营范围：加工：服装。(依法须经批准的项目，经相关部门批准后方可开展经营活动)〓 ［已认证］	注册地址：中国广东东莞虎门镇威远岛北面草铺6号五楼                                    查看地图	东莞 童装	https://mengleer.1688.com/page/creditdetail.htm	注册资本：无需验资 ［已认证］	东莞市虎门宜阁制衣厂	13712381909	mengleer	2018-03-26	联系人：李瑞	成立时间：2013年04月24日 ［已认证］
alibaba	经营范围：产销：服装、服装辅料。(依法须经批准的项目，经相关部门批准后方可开展经营活动)〓 ［已认证］	注册地址：中国广东东莞茶山镇增埗村卢屋路卢屋工业区                                    查看地图	东莞 童装	https://shop1381596863497.1688.com/page/creditdetail.htm	注册资本：无需验资 ［已认证］	东莞市茶山心之盈服装商行	13925830847	shop1381596863497	2018-03-26	联系人：卢惠芳	成立时间：2013年07月12日 ［已认证］
alibaba	经营范围：服饰、女装、男装、童装、鞋帽、针棉织品、日用品、皮具、箱包的设计与销售；国内贸易，货物及技术进出口。(法律、行政法规、国务院决定规定在登记前须经批准的项目除外）.. ［已认证］	注册地址：中国广东深圳宝安区西乡街道河东新村21号                                    查看地图	东莞 童装	https://shop6x88u446281m5.1688.com/page/creditdetail.htm	注册资本：人民币100万元 ［已认证］	深圳只爱大牛服饰有限公司	15625818762	shop6x88u446281m5	2018-03-26	联系人：	成立时间：2015年10月22日 ［已认证］
alibaba	经营范围：网上销售：服饰、工艺品。 ［已认证］	注册地址：中国广东东莞东城区下桥邮件处理中心东莞邮政（下桥）跨境电商园416室                                    查看地图	东莞 童装	https://passonbrand.1688.com/page/creditdetail.htm	注册资本：无需验资 ［已认证］	东莞市东城芭晨服饰经营部	13694947952	passonbrand	2018-03-26	联系人：刘丽琴	成立时间：2014年11月10日 ［已认证］
alibaba	经营范围：销售：毛衣。 (依法须经批准的项目，经相关部门批准后方可开展经营活动)〓 ［已认证］	注册地址：中国广东东莞大朗镇巷头毛织市场二楼170号                                    查看地图	东莞 童装	https://mwmy138.1688.com/page/creditdetail.htm	注册资本：无需验资 ［已认证］	东莞市大朗美伟毛衣店	13669870698	mwmy138	2018-03-26	联系人：潘伟	成立时间：2007年04月18日 ［已认证］
alibaba	经营范围：产销：服饰、服装、婴幼儿用品、鞋。 (依法须经批准的项目，经相关部门批准后方可开展经营活动)〓 ［已认证］	注册地址：中国广东东莞石龙镇下甲上塘三街303号五楼                                    查看地图	东莞 童装	https://boailianmeng.1688.com/page/creditdetail.htm	注册资本：人民币100万元 ［已认证］	东莞市淑君制衣有限公司	*	boailianmeng	2018-03-26	联系人：邱世查	成立时间：2015年03月16日 ［已认证］
alibaba	经营范围：生产、销售、网上销售、设计、加工：服饰、服装、服装辅料、针织品、梭织品、内衣、内裤、户外运动用品、床上用品、鞋、帽、袜、箱包；货物及技术进出口。(依法须经批准的.. ［已认证］	注册地址：中国广东东莞虎门镇人民中路55号后山边二楼                                    查看地图	东莞 童装	https://haitaifs.1688.com/page/creditdetail.htm	注册资本：人民币100万元 ［已认证］	东莞市海泰服饰有限公司	13431305085	haitaifs	2018-03-26	联系人：陈代兵	成立时间：2016年04月26日 ［已认证］
alibaba	注册资本：RMB 0 万元	注册地址：大朗镇长塘社区荔湾西路189号                                    查看地图	东莞 童装	https://shop1407517446230.1688.com/page/creditdetail.htm	成立时间：2014-07-31 00:00:00	东莞市大朗坤丽服装批发店	13649874902	shop1407517446230	2018-03-26	联系人：蔡宽	企业名称：东莞市大朗坤丽服装批发店 ［已认证］
alibaba	经营范围：销售:服装、服饰。(依法须经批准的项目，经相关部门批准后方可开展经营活动)〓 ［已认证］	注册地址：中国广东东莞茶山镇刘黄村第二工业区3号                                    查看地图	东莞 童装	https://shop1363368655522.1688.com/page/creditdetail.htm	注册资本：无需验资 ［已认证］	东莞市茶山凡顺服装商行	固话：0769 - 82251226	shop1363368655522	2018-03-26	联系人：曾凡莲	成立时间：2013年02月28日 ［已认证］
alibaba	经营范围：研发、设计、生产、加工、销售、网上销售：服装、布料、服饰、鞋、帽、箱包。 ［已认证］	注册地址：中国广东东莞虎门镇南栅社区第四工业区文明路9巷4号二楼                                    查看地图	东莞 童装	https://shop1368552467912.1688.com/page/creditdetail.htm	注册资本：人民币1,000万元 ［已认证］	USPIN官方旗舰店	18925466920	shop1368552467912	2018-03-26	联系人：刘国健	成立时间：2013年04月17日 ［已认证］
alibaba	经营范围：产销:服装、服饰；销售:纺织品、针织品、服装辅料、家用电器、五金电子产品、箱包、鞋类。(依法须经批准的项目，经相关部门批准后方可开展经营活动)〓 ［已认证］	注册地址：中国广东东莞虎门镇镇口社区第一工业区B44栋一楼102                                    查看地图	东莞 童装	https://shop994go3972n206.1688.com/page/creditdetail.htm	注册资本：人民币50万元 ［已认证］	东莞市超雅服饰有限公司	13925857726	shop994go3972n206	2018-03-26	联系人：蒋洪华	成立时间：2011年06月10日 ［已认证］
alibaba	经营范围：销售：服装、服饰、手袋、箱包、鞋。 ［已认证］	注册地址：中国广东东莞虎门镇沙角社区河仔新村二巷5号                                    查看地图	东莞 童装	https://anzuna.1688.com/page/creditdetail.htm	注册资本：人民币50万元 ［已认证］	东莞市安祖娜服饰有限公司	固话：0769 - 85508496	anzuna	2018-03-26	联系人：欧晓辉	成立时间：2017年04月24日 ［已认证］
alibaba	经营范围：销售：服装、百货。（依法须经批准的项目，经相关部门批准后方可开展经营活动） ［已认证］	注册地址：中国四川广安广安区建新街5号1幢附17号                                    查看地图	东莞 童装	https://shop2h63323135089.1688.com/page/creditdetail.htm	注册资本：人民币50万元 ［已认证］	广安市霓裳飞扬贸易有限公司	13620084485	shop2h63323135089	2018-03-26	联系人：	成立时间：2017年04月20日 ［已认证］
alibaba	经营范围：生产、加工、销售：服饰、服装、鞋、帽、袜、箱包；货物进出口。 (依法须经批准的项目，经相关部门批准后方可开展经营活动)〓 ［已认证］	注册地址：中国广东东莞虎门镇虎门寨社区振华路东下八巷34号六楼                                    查看地图	东莞 童装	https://ruo888wang.1688.com/page/creditdetail.htm	注册资本：人民币100万元 ［已认证］	东莞市若望依服饰有限公司	18925879559	ruo888wang	2018-03-26	联系人：鄢中章	成立时间：2017年06月07日 ［已认证］
alibaba	经营范围：批发、零售：服饰、服装。 ［已认证］	注册地址：中国广东东莞大朗镇黎贝岭村聚新四路223号                                    查看地图	东莞 童装	https://dyzfs13652525237.1688.com/page/creditdetail.htm	注册资本：人民币100万元 ［已认证］	东莞市豆芽仔服饰有限公司	13652525237	dyzfs13652525237	2018-03-26	联系人：谢玲	成立时间：2014年10月17日 ［已认证］
alibaba	经营范围：一般经营项目：服饰批发零售许可经营项目：服饰加工 ［已认证］	注册地址：中国广东深圳宝安区沙井街道兴业西路12号                                    查看地图	东莞 童装	https://shop1467219474368.1688.com/page/creditdetail.htm	注册资本：无需验资 ［已认证］	深圳市宝安区沙井汇衣堂服装厂	13600256300	shop1467219474368	2018-03-26	联系人：王超焕	成立时间：2016年06月23日 ［已认证］
alibaba	经营范围：服装的批发零售。^以下项目涉及应取得许可审批的，须凭相关审批文件方可经营:服装的生产加工。 ［已认证］	注册地址：中国广东深圳南山区西丽街道官龙村旺堂工业区9-2栋3楼                                    查看地图	东莞 童装	https://shop1442249573951.1688.com/page/creditdetail.htm	注册资本：无需验资 ［已认证］	深圳市南山区依衣莹服装厂	15119294634	shop1442249573951	2018-03-26	联系人：李肖兰	成立时间：2015年09月09日 ［已认证］
alibaba	注册资本：RMB 0 万元	注册地址：龙华新区龙华街道清湖工业区7栋一层                                    查看地图	东莞 童装	https://shopjack.1688.com/page/creditdetail.htm	成立时间：2016-01-27	深圳市龙华新区醉美人服装厂	13128102057	shopjack	2018-03-26	联系人：李德华	企业名称：深圳市龙华新区醉美人服装厂 ［已认证］
alibaba	注册资本：RMB 100 万元	注册地址：大朗镇巷头社区富康路233号大朗毛织贸易中心3-C039号                                    查看地图	东莞 童装	https://shop1408034428850.1688.com/page/creditdetail.htm	成立时间：2014-07-26 00:00:00	东莞市雅逸服装有限公司	13686065157	shop1408034428850	2018-03-26	联系人：张浩	企业名称：东莞市雅逸服装有限公司 ［已认证］
alibaba	注册资本：RMB 5 万元	注册地址：寮步镇凫山村向东五巷13号                                    查看地图	东莞 童装	https://weipai99.1688.com/page/creditdetail.htm	成立时间：2016-10-13 00:00:00	东莞市伟派童装服饰有限公司	18312200682	weipai99	2018-03-26	联系人：尹志成	企业名称：东莞市伟派童装服饰有限公司 ［已认证］
